{
  "name": "qdt_test_profile_complete",
  "alias": "Conférence QGIS FR",
  "description": "Profil de démonstration de la gestion des profils QGIS par Oslandia (atelier des journées QGIS FR 2022).",
  "author": "Benoît Ducarouge et Julien Moura",
  "email": "qgis@oslandia.com",
  "icon": "images/qgis_icon.ico",
  "splash": "images/splash_qgis-fr_600x287.png",
  "qgisMinimumVersion": "3.22",
  "qgisMaximumVersion": "3.30",
  "version": "1.1.0",
  "plugins": [
    {
      "name": "french_locator_filter",
      "version": "1.0.4",
      "url": "https://plugins.qgis.org/plugins/french_locator_filter/version/1.0.4/download/",
      "type": "remote",
      "plugin_id": 1846
    },
    {
      "name": "pg_metadata",
      "version": "1.2.1",
      "url": "https://plugins.qgis.org/plugins/pg_metadata/version/1.2.1/download/",
      "type": "remote"
    },
    {
      "name": "Layers menu from project",
      "version": "v2.0.6",
      "url": "https://plugins.qgis.org/plugins/menu_from_project/version/v2.0.6/download/",
      "type": "remote"
    },
    {
      "name": "Geotuileur",
      "version": "1.0.0",
      "url": "https://oslandia.gitlab.io/qgis/ign-geotuileur/geotuileur.1.0.0.zip",
      "location": "remote",
      "official_repository": false,
      "repository_url_xml": "https://oslandia.gitlab.io/qgis/ign-geotuileur/plugins.xml"
    }
  ]
}